{
  "$schema": "https://json-schema.org/draft/2020-12/schema",
  "$id": "validation-report.schema.json",
  "title": "Codex Game Atelier validation report",
  "type": "object",
  "additionalProperties": false,
  "required": ["schema_version", "scope", "outcome", "checks"],
  "properties": {
    "schema_version": { "$ref": "common.schema.json#/$defs/schemaVersion" },
    "scope": { "type": "string", "enum": ["baseline", "headless"] },
    "outcome": { "type": "string", "enum": ["PASS", "FAIL", "BLOCKED", "SKIPPED"] },
    "checks": {
      "type": "array",
      "minItems": 1,
      "maxItems": 64,
      "items": {
        "type": "object",
        "additionalProperties": false,
        "required": ["id", "outcome", "summary"],
        "properties": {
          "id": { "type": "string", "pattern": "^[a-z][a-z0-9-]{0,63}$" },
          "outcome": { "type": "string", "enum": ["PASS", "FAIL", "BLOCKED", "SKIPPED"] },
          "summary": { "type": "string", "minLength": 1, "maxLength": 512 }
        }
      }
    }
  }
}
